{
  "capability": {
    "capabilityId": "contacts.identity.reveal",
    "capabilityVersion": "1.0.0"
  },
  "datasetId": "dataset-derived-identities",
  "fields": [
    {
      "datasetId": "dataset-derived-identities",
      "fieldId": "field-display-name",
      "key": "display_name",
      "label": "Display name",
      "valueType": "string",
      "workspaceId": "workspace-synthetic"
    }
  ],
  "generationId": "generation-identity",
  "generationPlanId": "generation-plan-identity",
  "inputCursor": null,
  "kind": "dataset-generation-page-input",
  "limits": {
    "maxCalls": 1,
    "maxCompanies": 0,
    "maxContactsPerCompany": 0,
    "maxContactsTotal": 1,
    "maxEnrichments": 1,
    "maxPages": 1,
    "maxPhones": 0,
    "maxResults": 1
  },
  "normalizedQuery": {
    "result_kind": "contact_identity",
    "selected_contacts": [
      {
        "candidate": {
          "department": "sales",
          "display_name": "S. Contact",
          "identity_completeness": "obfuscated",
          "job_title": "Director",
          "observed_at_ms": 1000,
          "organization_domain": "company.example",
          "organization_id": "company-1",
          "organization_name": "Synthetic Company",
          "person_country_code": "ES",
          "profile_url": null,
          "seniority": "director"
        },
        "provider_identity": {
          "provider_key": "apollo-people-search",
          "provider_subject_id": "person-synthetic-1"
        },
        "source_record_id": "contact-1"
      }
    ],
    "source_dataset_id": "dataset-source-contacts"
  },
  "pageSequence": 1,
  "planHash": "sha256:aaaaaaaaaaaaaaaaaaaaaaaaaaaaaaaaaaaaaaaaaaaaaaaaaaaaaaaaaaaaaaaa",
  "queryHash": "sha256:bbbbbbbbbbbbbbbbbbbbbbbbbbbbbbbbbbbbbbbbbbbbbbbbbbbbbbbbbbbbbbbb",
  "schemaHash": "sha256:cccccccccccccccccccccccccccccccccccccccccccccccccccccccccccccccc",
  "version": "1.0.0",
  "workspaceId": "workspace-synthetic"
}
